{
  "version": 0,
  "enabled": true,
  "wall_segment_tiles": 20.0,
  "torches_per_segment_min": 1,
  "torches_per_segment_max": 1,
  "wall_inset": 0.55,
  "wall_end_margin": 0.75,
  "max_shader_torches": 32,
  "mount_height_fraction": 0.72,
  "fog_light_radius": 6.0,
  "torch_feather_world": 0.35,
  "omni_light_enabled": true,
  "omni_range": 4.5,
  "omni_energy": 1.8,
  "light_color": "#ff9b3d",
  "flame_color": "#ff7a1a",
  "flame_emission_color": "#ffd45a",
  "flame_emission_energy": 6.0,
  "flame_radius_top": 0.16,
  "flame_radius_bottom": 0.22,
  "flame_height": 0.50,
  "bracket_width": 0.18,
  "bracket_height": 0.38
}
